{"coordinates":{"char_end":22,"char_start":4,"column_index":null,"page_number":null,"paragraph_index":null,"row_index":null,"table_index":null},"locator":"loc:v1/chars:4-22","output_sha256":"e4e050e5c591768e339d561cd16919d0f949774538d2e13817db6fa172424cb2","parse_status":"parsed","parser_name":"fixture-parser","parser_version":"1.0.0","quality_flags":[],"raw_text":"Revenue increased.","schema_version":"1.0.0","source_id":"urn:company-wiki:source:sha256:d9b0df81476e5c29dedd8acc8438f0dcfd8f45585a4f246e1cbc243ed4dd4de3","span_id":"urn:company-wiki:evidence-span:sha256:1e4f1c7d0c4dd2a77b01a2fc25228dcb63fe71fb4b6c250e9780fa3360623671","structured_value":null}
